{
  "$schema": "https://json-schema.org/draft/2020-12/schema",
  "type": "object",
  "required": [
    "schema_version",
    "id",
    "page_id",
    "question",
    "audience_message",
    "source_claim_ids",
    "carrier_id",
    "protected_regions",
    "states",
    "relations",
    "timing",
    "loop_contract",
    "static_summary",
    "lifecycle_api",
    "reduced_motion",
    "cleanup",
    "audience_playback_ui"
  ],
  "properties": {
    "schema_version": {
      "const": "6.0"
    },
    "id": {
      "type": "string",
      "minLength": 1
    },
    "page_id": {
      "type": "string",
      "minLength": 1
    },
    "question": {
      "type": "string",
      "minLength": 1
    },
    "audience_message": {
      "type": "string",
      "minLength": 1
    },
    "carrier_id": {
      "type": "string",
      "minLength": 1
    },
    "loop_contract": {
      "type": "string",
      "minLength": 1
    },
    "static_summary": {
      "type": "string",
      "minLength": 1
    },
    "reduced_motion": {
      "type": "string",
      "minLength": 1
    },
    "cleanup": {
      "type": "string",
      "minLength": 1
    },
    "source_claim_ids": {
      "type": "array",
      "minItems": 1,
      "items": {
        "type": "string"
      }
    },
    "protected_regions": {
      "type": "array",
      "items": {
        "type": "object",
        "required": [
          "id",
          "rect",
          "role"
        ],
        "properties": {
          "id": {
            "type": "string"
          },
          "rect": {
            "type": "array",
            "prefixItems": [
              {
                "type": "number"
              },
              {
                "type": "number"
              },
              {
                "type": "number"
              },
              {
                "type": "number"
              }
            ],
            "items": false,
            "minItems": 4,
            "maxItems": 4
          },
          "role": {
            "enum": [
              "title",
              "logo",
              "header",
              "footer",
              "body",
              "takeaway",
              "control",
              "data",
              "other"
            ]
          },
          "motion_margin": {
            "type": "number",
            "minimum": 0
          }
        },
        "additionalProperties": false
      }
    },
    "states": {
      "type": "array",
      "minItems": 4,
      "items": {
        "type": "object",
        "required": [
          "t",
          "x",
          "y",
          "w",
          "h",
          "r",
          "tint",
          "label",
          "caption",
          "source_claim_ids",
          "explanation_task"
        ],
        "properties": {
          "t": {
            "type": "number"
          },
          "x": {
            "type": "number"
          },
          "y": {
            "type": "number"
          },
          "w": {
            "type": "number"
          },
          "h": {
            "type": "number"
          },
          "r": {
            "type": "number"
          },
          "tint": {
            "type": "array",
            "items": {
              "type": "number"
            },
            "minItems": 4,
            "maxItems": 4
          },
          "label": {
            "type": "string"
          },
          "caption": {
            "type": "string"
          },
          "source_claim_ids": {
            "type": "array",
            "minItems": 1,
            "uniqueItems": true,
            "items": {
              "type": "string",
              "minLength": 1
            }
          },
          "explanation_task": {
            "type": "string",
            "minLength": 1
          }
        },
        "additionalProperties": false
      },
      "description": "关键帧：至少三个阅读状态加一个回到首状态的收束帧（06 FILM-01）"
    },
    "relations": {
      "type": "array",
      "items": {
        "type": "object",
        "required": [
          "from",
          "to",
          "meaning",
          "start",
          "end",
          "source_claim_ids",
          "explanation_task"
        ],
        "properties": {
          "from": {
            "type": "string"
          },
          "to": {
            "type": "string"
          },
          "meaning": {
            "type": "string"
          },
          "start": {
            "type": "number"
          },
          "end": {
            "type": "number"
          },
          "source_claim_ids": {
            "type": "array",
            "minItems": 1,
            "uniqueItems": true,
            "items": {
              "type": "string",
              "minLength": 1
            }
          },
          "explanation_task": {
            "type": "string",
            "minLength": 1
          }
        },
        "additionalProperties": false
      }
    },
    "timing": {
      "type": "object",
      "required": [
        "duration_ms",
        "reading_basis"
      ],
      "properties": {
        "duration_ms": {
          "type": "integer",
          "minimum": 1000
        },
        "reading_basis": {
          "type": "string"
        }
      },
      "additionalProperties": false
    },
    "lifecycle_api": {
      "type": "array",
      "items": {
        "enum": [
          "pause",
          "resume",
          "seek",
          "snapshot",
          "dispose"
        ]
      },
      "minItems": 5,
      "uniqueItems": true,
      "description": "Internal lifecycle/QC API only; never audience playback UI"
    },
    "audience_playback_ui": {
      "const": false
    }
  },
  "additionalProperties": false
}
