{
  "schema_version": "6.0",
  "id": "demo-evidence",
  "page_id": "hero",
  "question": "资料如何变为可审阅信息",
  "audience_message": "先界定问题，再组织证据，最后进行审阅",
  "source_claim_ids": [
    "synthetic-demo"
  ],
  "carrier_id": "main-film-carrier",
  "protected_regions": [
    {
      "id": "detail-nodes",
      "rect": [
        0.02,
        0.74,
        0.96,
        0.24
      ],
      "role": "body"
    }
  ],
  "states": [
    {
      "t": 0,
      "x": 0.08,
      "y": 0.16,
      "w": 0.36,
      "h": 0.33,
      "r": 0.45,
      "tint": [
        255,
        244,
        220,
        0.72
      ],
      "label": "研究问题",
      "caption": "界定研究对象、评价范围和需要解决的问题。",
      "source_claim_ids": [
        "synthetic-demo"
      ],
      "explanation_task": "合成演示：界定研究对象、评价范围和需要解决的问题。"
    },
    {
      "t": 0.3,
      "x": 0.2,
      "y": 0.13,
      "w": 0.49,
      "h": 0.46,
      "r": 0.14,
      "tint": [
        255,
        248,
        233,
        0.78
      ],
      "label": "证据整理",
      "caption": "将资料、关键数据与限制条件汇集为可审阅的信息。",
      "source_claim_ids": [
        "synthetic-demo"
      ],
      "explanation_task": "合成演示：将资料、关键数据与限制条件汇集为可审阅的信息。"
    },
    {
      "t": 0.62,
      "x": 0.1,
      "y": 0.1,
      "w": 0.79,
      "h": 0.53,
      "r": 0.1,
      "tint": [
        247,
        250,
        252,
        0.86
      ],
      "label": "决策审阅",
      "caption": "比较证据和可选方案，形成明确的审阅意见。",
      "source_claim_ids": [
        "synthetic-demo"
      ],
      "explanation_task": "合成演示：比较证据和可选方案，形成明确的审阅意见。"
    },
    {
      "t": 0.88,
      "x": 0.08,
      "y": 0.16,
      "w": 0.36,
      "h": 0.33,
      "r": 0.45,
      "tint": [
        255,
        244,
        220,
        0.72
      ],
      "label": "研究问题",
      "caption": "界定研究对象、评价范围和需要解决的问题。",
      "source_claim_ids": [
        "synthetic-demo"
      ],
      "explanation_task": "合成演示：界定研究对象、评价范围和需要解决的问题。"
    }
  ],
  "relations": [
    {
      "from": "研究问题",
      "to": "证据整理",
      "meaning": "组织需要的证据，不表示临床因果",
      "start": 0.12,
      "end": 0.42,
      "source_claim_ids": [
        "synthetic-demo"
      ],
      "explanation_task": "合成演示：组织需要的证据，不表示临床因果"
    },
    {
      "from": "证据整理",
      "to": "决策审阅",
      "meaning": "证据用于审阅",
      "start": 0.42,
      "end": 0.74,
      "source_claim_ids": [
        "synthetic-demo"
      ],
      "explanation_task": "合成演示：证据用于审阅"
    }
  ],
  "timing": {
    "duration_ms": 36000,
    "reading_basis": "短阶段说明停留至少数秒；复杂实际页面需重新测读。"
  },
  "loop_contract": "几何、颜色、标签、说明首尾一致；持续存在同一 DOM 主载体",
  "static_summary": "页面中三个阶段节点以及下方明细始终可阅读",
  "reduced_motion": "固定在 .74 的静态总览；保留静态资料",
  "cleanup": "暂停、移除监听器、断开观察器，保留当前暂停原因",
  "lifecycle_api": [
    "pause",
    "resume",
    "seek",
    "snapshot",
    "dispose"
  ],
  "audience_playback_ui": false
}